{
  "command_version": 1,
  "manifest_version": 2,
  "command_id": "cmd-meeting-approval-01",
  "command": "approve",
  "actor": {
    "id": "user-synthetic-01",
    "type": "user",
    "authenticated_by": "dash_session",
    "display_name": "Example User"
  },
  "target": {
    "agent_id": "synthetic-gmail-meeting-assistant",
    "run_id": "run-synthetic-20260716-01",
    "task_id": "task-meeting-01",
    "approval_id": "approval-meeting-01",
    "action_id": "action-create-invite-draft"
  },
  "issued_at": "2026-07-16T09:06:00Z",
  "expires_at": "2026-07-16T09:11:00Z",
  "nonce": "nonce-synthetic-000001",
  "idempotency_key": "idem-meeting-approval-01",
  "payload": { "reason": "Approved the selected synthetic meeting time" },
  "audit": { "correlation_id": "corr-meeting-01", "causation_id": "approval-meeting-01" }
}
